{
  "apiVersion": "qos-binding/v1",
  "kind": "Optimization",
  "metadata": {
    "name": "bultan2003_warehouse_example_mono_utility_soft_optimization"
  },
  "spec": {
    "mode": "weighted",
    "terms": [
      {
        "feature": {
          "resource": "application",
          "id": "availability"
        },
        "weight": 0.2,
        "normalize": {
          "min": 0,
          "max": 1,
          "clamp": true
        }
      },
      {
        "feature": {
          "resource": "application",
          "id": "cost_usd"
        },
        "weight": 0.2,
        "normalize": {
          "min": 0,
          "max": 1000,
          "clamp": true
        }
      },
      {
        "feature": {
          "resource": "application",
          "id": "latency_ms"
        },
        "weight": 0.2,
        "normalize": {
          "min": 0,
          "max": 5000,
          "clamp": true
        }
      },
      {
        "feature": {
          "resource": "application",
          "id": "reliability"
        },
        "weight": 0.2,
        "normalize": {
          "min": 0.0,
          "max": 1.0,
          "clamp": true
        }
      },
      {
        "feature": {
          "resource": "application",
          "id": "security"
        },
        "weight": 0.2,
        "normalize": {
          "min": 1,
          "max": 5,
          "clamp": true
        }
      }
    ],
    "penalties": [
      {
        "constraint": {
          "resource": "constraints",
          "id": "gen_c_global_latency_ms_1"
        },
        "weight": 1
      },
      {
        "constraint": {
          "resource": "constraints",
          "id": "gen_c_local_t_receipt2_security_1"
        },
        "weight": 1
      },
      {
        "constraint": {
          "resource": "constraints",
          "id": "gen_c_dep_same_1"
        },
        "weight": 1
      }
    ]
  }
}
