{
  "apiVersion": "qos-binding/v1",
  "kind": "Optimization",
  "metadata": {
    "name": "cremaschi2018_textbook_access_multi_hard_optimization"
  },
  "spec": {
    "mode": "pareto",
    "terms": [
      {
        "feature": {
          "resource": "application",
          "id": "availability"
        },
        "normalize": {
          "min": 0,
          "max": 1,
          "clamp": true
        }
      },
      {
        "feature": {
          "resource": "application",
          "id": "cost_usd"
        },
        "normalize": {
          "min": 0,
          "max": 10,
          "clamp": true
        }
      },
      {
        "feature": {
          "resource": "application",
          "id": "latency_ms"
        },
        "normalize": {
          "min": 0,
          "max": 10000,
          "clamp": true
        }
      }
    ]
  }
}
