{
  "apiVersion": "qos-binding/v1",
  "kind": "Optimization",
  "metadata": {
    "name": "netedu2020_transport_agency_many_soft_optimization"
  },
  "spec": {
    "mode": "pareto",
    "terms": [
      {
        "feature": {
          "resource": "application",
          "id": "availability"
        },
        "normalize": {
          "min": 0,
          "max": 1,
          "clamp": true
        }
      },
      {
        "feature": {
          "resource": "application",
          "id": "cost"
        },
        "normalize": {
          "min": 0,
          "max": 1000,
          "clamp": true
        }
      },
      {
        "feature": {
          "resource": "application",
          "id": "execution_time"
        },
        "normalize": {
          "min": 0,
          "max": 20000,
          "clamp": true
        }
      },
      {
        "feature": {
          "resource": "application",
          "id": "reliability"
        },
        "normalize": {
          "min": 0.0,
          "max": 1.0,
          "clamp": true
        }
      },
      {
        "feature": {
          "resource": "application",
          "id": "security"
        },
        "normalize": {
          "min": 1,
          "max": 5,
          "clamp": true
        }
      }
    ],
    "penalties": [
      {
        "constraint": {
          "resource": "constraints",
          "id": "gen_c_global_cost_1"
        },
        "weight": 1
      },
      {
        "constraint": {
          "resource": "constraints",
          "id": "gen_c_local_t_get_closest_city_reliability_1"
        },
        "weight": 1
      },
      {
        "constraint": {
          "resource": "constraints",
          "id": "gen_c_dep_same_1"
        },
        "weight": 1
      }
    ]
  }
}
